<xs:schema xmlns:xs="http://www.w3.org/2001/XMLSchema">
    <xs:element name="libreria">
        <xs:complexType>
            <xs:sequence>
                <xs:element name="libro" maxOccurs="unbounded">
                    <xs:complexType>
                        <xs:sequence>
                            <xs:element name="titulo"/>
                            <xs:element name="autor" maxOccurs="unbounded"/>
                            <xs:element name="genero" maxOccurs="unbounded"/>
                            <xs:element name="fecha-publicacion"/>
                        </xs:sequence>
                    </xs:complexType>
                </xs:element>
            </xs:sequence>
        </xs:complexType>
    </xs:element>

    <xs:element name="titulo">
        <xs:simpleType>
            <xs:restriction base="xs:string">
                <xs:maxLength value="50"/>
            </xs:restriction>
        </xs:simpleType>
    </xs:element>

    <xs:element name="autor">
        <xs:simpleType>
            <xs:restriction base="xs:string">
                <xs:maxLength value="30"/>
            </xs:restriction>
        </xs:simpleType>
    </xs:element>

    <xs:element name="genero">
        <xs:simpleType>
            <xs:restriction base="xs:string">
                <xs:maxLength value="20"/>
            </xs:restriction>
        </xs:simpleType>
    </xs:element>

    <xs:element name="fecha-publicacion">
        <xs:simpleType>
            <xs:restriction base="xs:integer">
                <xs:minInclusive value="0" />
                <xs:maxInclusive value="2025" />
            </xs:restriction>
        </xs:simpleType>
    </xs:element>
</xs:schema>